{
  "schemaVersion": "1.0.0",
  "registryVersion": "hipaa-assurance-synthetic-v1",
  "synthetic": true,
  "legalDisclaimer": "Contract machinery only; no legal role, HIPAA compliance, certification, vendor approval, or production-PHI authorization is asserted.",
  "applicability": [
    {
      "id": "APP_RIDER_INTAKE", "workflow": "RIDER_INTAKE", "status": "UNDETERMINED", "ruleFamilies": ["PRIVACY", "SECURITY", "BREACH_NOTIFICATION", "BAA_SUBPROCESSOR"],
      "jurisdiction": "UNDETERMINED_LAUNCH_SCOPE", "rationale": "Customer relationship, contracts, and legal role require qualified review.",
      "sourceIds": ["SRC_HHS_PRIVACY"], "reviewerRole": "PRIVACY_OFFICIAL_ROLE", "effectiveDate": "2026-08-24",
      "approvalState": "PENDING_QUALIFIED_REVIEW", "approvalEvidenceRef": null, "recordVersion": 1, "supersedes": null, "immutableHistory": true
    },
    {
      "id": "APP_LIVE_LOCATION", "workflow": "ASSIGNED_SERVICE_DELIVERY", "status": "UNDETERMINED", "ruleFamilies": ["PRIVACY", "SECURITY", "LOCATION_PRIVACY"],
      "jurisdiction": "UNDETERMINED_LAUNCH_SCOPE", "rationale": "Precise location requires independent controls even if a workflow falls outside HIPAA.",
      "sourceIds": ["SRC_HHS_SECURITY"], "reviewerRole": "PRIVACY_OFFICIAL_ROLE", "effectiveDate": "2026-08-24",
      "approvalState": "PENDING_QUALIFIED_REVIEW", "approvalEvidenceRef": null, "recordVersion": 1, "supersedes": null, "immutableHistory": true
    },
    {
      "id": "APP_BILLING_PROOF", "workflow": "BILLING_PROOF", "status": "UNDETERMINED", "ruleFamilies": ["PRIVACY", "SECURITY", "BREACH_NOTIFICATION", "BAA_SUBPROCESSOR"],
      "jurisdiction": "UNDETERMINED_LAUNCH_SCOPE", "rationale": "Payer and customer contracts have not been reviewed.",
      "sourceIds": ["SRC_HHS_PRIVACY", "SRC_HHS_BAA"], "reviewerRole": "PRIVACY_OFFICIAL_ROLE", "effectiveDate": "2026-08-24",
      "approvalState": "PENDING_QUALIFIED_REVIEW", "approvalEvidenceRef": null, "recordVersion": 1, "supersedes": null, "immutableHistory": true
    }
  ],
  "controls": [
    {
      "id": "CTRL_PRIVACY_MINIMUM_NECESSARY", "ruleFamily": "PRIVACY", "sourceIds": ["SRC_HHS_MINIMUM_NECESSARY"], "designation": "REQUIRED_IF_APPLICABLE",
      "safeguardType": "ADMINISTRATIVE", "ownerRole": "PRIVACY_OFFICIAL_ROLE", "policyRef": "POL_MINIMUM_NECESSARY_V1",
      "implementationRationale": "Use purpose-aware field projections and deny excess fields.", "evidenceExpectations": ["role-projection-tests", "access-review"],
      "reviewCadence": { "value": 1, "unit": "year" }, "nextReview": "2027-08-24", "implementationState": "PLANNED",
      "evidenceState": "PLANNED", "exceptionState": "NONE", "remediationRef": null, "approvalState": "PENDING_QUALIFIED_REVIEW",
      "recordVersion": 1, "supersedes": null, "immutableHistory": true
    },
    {
      "id": "CTRL_SECURITY_RISK_ANALYSIS", "ruleFamily": "SECURITY", "sourceIds": ["SRC_HHS_RISK_ANALYSIS"], "designation": "REQUIRED_IF_APPLICABLE",
      "safeguardType": "ADMINISTRATIVE", "ownerRole": "SECURITY_OFFICIAL_ROLE", "policyRef": "POL_RISK_MANAGEMENT_V1",
      "implementationRationale": "Maintain asset, flow, threat, vulnerability, safeguard, and residual-risk records.", "evidenceExpectations": ["risk-register", "risk-treatment-validation"],
      "reviewCadence": { "value": 1, "unit": "year" }, "nextReview": "2027-08-24", "implementationState": "PLANNED",
      "evidenceState": "PLANNED", "exceptionState": "OPEN", "remediationRef": "RISK_CRITICAL_UNTREATED", "approvalState": "PENDING_QUALIFIED_REVIEW",
      "recordVersion": 1, "supersedes": null, "immutableHistory": true
    },
    {
      "id": "CTRL_SECURITY_ACCESS", "ruleFamily": "SECURITY", "sourceIds": ["SRC_HHS_SECURITY"], "designation": "REQUIRED_IF_APPLICABLE",
      "safeguardType": "TECHNICAL", "ownerRole": "SECURITY_OFFICIAL_ROLE", "policyRef": "POL_ACCESS_CONTROL_V1",
      "implementationRationale": "Require unique identity, tenant scope, least privilege, expiry, and break-glass audit.", "evidenceExpectations": ["access-tests", "access-review", "break-glass-review"],
      "reviewCadence": { "value": 3, "unit": "month" }, "nextReview": "2026-11-24", "implementationState": "PLANNED",
      "evidenceState": "PLANNED", "exceptionState": "NONE", "remediationRef": null, "approvalState": "PENDING_QUALIFIED_REVIEW",
      "recordVersion": 1, "supersedes": null, "immutableHistory": true
    },
    {
      "id": "CTRL_SECURITY_AUDIT", "ruleFamily": "SECURITY", "sourceIds": ["SRC_HHS_SECURITY"], "designation": "REQUIRED_IF_APPLICABLE",
      "safeguardType": "TECHNICAL", "ownerRole": "SECURITY_OFFICIAL_ROLE", "policyRef": "POL_AUDIT_V1",
      "implementationRationale": "Preserve actor, purpose, result, and material-change lineage without sensitive payloads.", "evidenceExpectations": ["audit-contract-test", "access-review"],
      "reviewCadence": { "value": 3, "unit": "month" }, "nextReview": "2026-11-24", "implementationState": "PLANNED",
      "evidenceState": "PLANNED", "exceptionState": "NONE", "remediationRef": null, "approvalState": "PENDING_QUALIFIED_REVIEW",
      "recordVersion": 1, "supersedes": null, "immutableHistory": true
    },
    {
      "id": "CTRL_SECURITY_INTEGRITY", "ruleFamily": "SECURITY", "sourceIds": ["SRC_HHS_SECURITY"], "designation": "ADDRESSABLE_IF_APPLICABLE",
      "addressableAssessment": "Implementation is required unless a documented risk assessment selects and justifies an equivalent measure; ADDRESSABLE never means optional.",
      "safeguardType": "TECHNICAL", "ownerRole": "SECURITY_OFFICIAL_ROLE", "policyRef": "POL_INTEGRITY_V1",
      "implementationRationale": "Version, hash, and append-only lineage protect material evidence.", "evidenceExpectations": ["integrity-test", "amendment-history"],
      "reviewCadence": { "value": 1, "unit": "year" }, "nextReview": "2027-08-24", "implementationState": "PLANNED",
      "evidenceState": "PLANNED", "exceptionState": "NONE", "remediationRef": null, "approvalState": "PENDING_QUALIFIED_REVIEW",
      "recordVersion": 1, "supersedes": null, "immutableHistory": true
    },
    {
      "id": "CTRL_SECURITY_AUTHENTICATION", "ruleFamily": "SECURITY", "sourceIds": ["SRC_HHS_SECURITY"], "designation": "REQUIRED_IF_APPLICABLE",
      "safeguardType": "TECHNICAL", "ownerRole": "SECURITY_OFFICIAL_ROLE", "policyRef": "POL_AUTHENTICATION_V1",
      "implementationRationale": "Authenticate people and system actors before regulated access.", "evidenceExpectations": ["authentication-tests", "session-review"],
      "reviewCadence": { "value": 1, "unit": "year" }, "nextReview": "2027-08-24", "implementationState": "PLANNED",
      "evidenceState": "PLANNED", "exceptionState": "NONE", "remediationRef": null, "approvalState": "PENDING_QUALIFIED_REVIEW",
      "recordVersion": 1, "supersedes": null, "immutableHistory": true
    },
    {
      "id": "CTRL_SECURITY_TRANSMISSION", "ruleFamily": "SECURITY", "sourceIds": ["SRC_HHS_SECURITY"], "designation": "ADDRESSABLE_IF_APPLICABLE",
      "addressableAssessment": "Transmission protection requires documented risk assessment and suitable safeguards; omission requires qualified rationale and equivalent control.",
      "safeguardType": "TECHNICAL", "ownerRole": "SECURITY_OFFICIAL_ROLE", "policyRef": "POL_TRANSMISSION_V1",
      "implementationRationale": "Protect approved payloads in transit and deny unapproved egress.", "evidenceExpectations": ["transport-test", "egress-policy-test"],
      "reviewCadence": { "value": 1, "unit": "year" }, "nextReview": "2027-08-24", "implementationState": "PLANNED",
      "evidenceState": "PLANNED", "exceptionState": "NONE", "remediationRef": null, "approvalState": "PENDING_QUALIFIED_REVIEW",
      "recordVersion": 1, "supersedes": null, "immutableHistory": true
    },
    {
      "id": "CTRL_BREACH_RESPONSE", "ruleFamily": "BREACH_NOTIFICATION", "sourceIds": ["SRC_HHS_BREACH"], "designation": "REQUIRED_IF_APPLICABLE",
      "safeguardType": "ADMINISTRATIVE", "ownerRole": "PRIVACY_OFFICIAL_ROLE", "policyRef": "POL_INCIDENT_BREACH_V1",
      "implementationRationale": "Preserve discovery and risk-assessment facts while qualified authority decides notification.", "evidenceExpectations": ["incident-exercise", "decision-lineage"],
      "reviewCadence": { "value": 1, "unit": "year" }, "nextReview": "2027-08-24", "implementationState": "PLANNED",
      "evidenceState": "PLANNED", "exceptionState": "OPEN", "remediationRef": "INC_POTENTIAL_DISCLOSURE", "approvalState": "PENDING_QUALIFIED_REVIEW",
      "recordVersion": 1, "supersedes": null, "immutableHistory": true
    },
    {
      "id": "CTRL_BAA_EXACT_SERVICE", "ruleFamily": "BAA_SUBPROCESSOR", "sourceIds": ["SRC_HHS_BAA", "SRC_HHS_NO_SELF_CERT_BAA"], "designation": "REQUIRED_IF_APPLICABLE",
      "safeguardType": "ADMINISTRATIVE", "ownerRole": "PRIVACY_OFFICIAL_ROLE", "policyRef": "POL_VENDOR_BAA_V1",
      "implementationRationale": "Verify the exact legal entity, service, configuration, region, subprocessors, and executed agreement.", "evidenceExpectations": ["executed-baa-reference", "service-configuration-review", "subprocessor-register"],
      "reviewCadence": { "value": 1, "unit": "year" }, "nextReview": "2027-08-24", "implementationState": "PLANNED",
      "evidenceState": "PLANNED", "exceptionState": "OPEN", "remediationRef": "VENDOR_SYNTHETIC_MISSING_BAA", "approvalState": "PENDING_QUALIFIED_REVIEW",
      "recordVersion": 1, "supersedes": null, "immutableHistory": true
    },
    {
      "id": "CTRL_PERIODIC_EVALUATION", "ruleFamily": "SECURITY", "sourceIds": ["SRC_HHS_AUDIT_PROTOCOL", "SRC_HHS_NO_CERTIFICATION"], "designation": "REQUIRED_IF_APPLICABLE",
      "safeguardType": "ADMINISTRATIVE", "ownerRole": "SECURITY_OFFICIAL_ROLE", "policyRef": "POL_PERIODIC_EVALUATION_V1",
      "implementationRationale": "Perform technical and non-technical evaluation on cadence and after material change.", "evidenceExpectations": ["evaluation-record", "remediation-review"],